{
    "target_ids": ["CVE-1900-1234"],
    "timestamp": "2021-09-29T15:29:44Z",
    "schemaVersion": "2.0.0",
    "selections": [
	{
	    "namespace": "ssvc",
	    "name": "Exploitation",
	    "key": "E",
	    "version": "1.1.0",
	    "values": [
		{"name":"Active", "key": "A"}
	    ]
	},
	{
	    "namespace": "ssvc",
	    "name": "Automatable",
	    "key": "A",
	    "version": "2.0.0",
	    "values": [
		{"name": "Yes", "key": "Y"}
	    ]
	},
	{
	    "namespace": "ssvc",
	    "name": "Technical Impact",
	    "key": "TI",
	    "version": "1.0.0",
	    "values": [
		{"name": "Total","key":"T"}
	    ]
	}
    ]
}
